{
  "schema_version": "0.1.0",
  "suite_id": "web-focus-pilot",
  "run_id": "replace-before-testing",
  "performed_at": null,
  "environment": {
    "agent": "not-recorded",
    "model": "not-recorded",
    "browser": "not-recorded",
    "os": "not-recorded",
    "viewport": "not-recorded",
    "zoom": "not-recorded",
    "keyboard_settings": "not-recorded"
  },
  "results": [
    {
      "case_id": "case-01",
      "check_id": "focus-visible",
      "testing_track": "section508-baseline",
      "baseline_procedure_id": "2.A-FocusVisible",
      "status": "not-tested",
      "stage": "initial",
      "artifact_sha256": null,
      "tester_type": "none",
      "evidence": [],
      "rationale": "Not yet performed; replace only with actual observations.",
      "local_procedure_id": null
    },
    {
      "case_id": "case-01",
      "check_id": "focus-not-obscured",
      "testing_track": "supplemental-wcag22",
      "baseline_procedure_id": null,
      "status": "not-tested",
      "stage": "initial",
      "artifact_sha256": null,
      "tester_type": "none",
      "evidence": [],
      "rationale": "Not yet performed; replace only with actual observations.",
      "local_procedure_id": "SUP-WEB-FOCUS-01"
    },
    {
      "case_id": "case-02",
      "check_id": "focus-visible",
      "testing_track": "section508-baseline",
      "baseline_procedure_id": "2.A-FocusVisible",
      "status": "not-tested",
      "stage": "initial",
      "artifact_sha256": null,
      "tester_type": "none",
      "evidence": [],
      "rationale": "Not yet performed; replace only with actual observations.",
      "local_procedure_id": null
    },
    {
      "case_id": "case-02",
      "check_id": "focus-not-obscured",
      "testing_track": "supplemental-wcag22",
      "baseline_procedure_id": null,
      "status": "not-tested",
      "stage": "initial",
      "artifact_sha256": null,
      "tester_type": "none",
      "evidence": [],
      "rationale": "Not yet performed; replace only with actual observations.",
      "local_procedure_id": "SUP-WEB-FOCUS-01"
    },
    {
      "case_id": "case-03",
      "check_id": "focus-visible",
      "testing_track": "section508-baseline",
      "baseline_procedure_id": "2.A-FocusVisible",
      "status": "not-tested",
      "stage": "initial",
      "artifact_sha256": null,
      "tester_type": "none",
      "evidence": [],
      "rationale": "Not yet performed; replace only with actual observations.",
      "local_procedure_id": null
    },
    {
      "case_id": "case-03",
      "check_id": "focus-not-obscured",
      "testing_track": "supplemental-wcag22",
      "baseline_procedure_id": null,
      "status": "not-tested",
      "stage": "initial",
      "artifact_sha256": null,
      "tester_type": "none",
      "evidence": [],
      "rationale": "Not yet performed; replace only with actual observations.",
      "local_procedure_id": "SUP-WEB-FOCUS-01"
    },
    {
      "case_id": "case-04",
      "check_id": "focus-visible",
      "testing_track": "section508-baseline",
      "baseline_procedure_id": "2.A-FocusVisible",
      "status": "not-tested",
      "stage": "initial",
      "artifact_sha256": null,
      "tester_type": "none",
      "evidence": [],
      "rationale": "Not yet performed; replace only with actual observations.",
      "local_procedure_id": null
    },
    {
      "case_id": "case-04",
      "check_id": "focus-not-obscured",
      "testing_track": "supplemental-wcag22",
      "baseline_procedure_id": null,
      "status": "not-tested",
      "stage": "initial",
      "artifact_sha256": null,
      "tester_type": "none",
      "evidence": [],
      "rationale": "Not yet performed; replace only with actual observations.",
      "local_procedure_id": "SUP-WEB-FOCUS-01"
    },
    {
      "case_id": "case-05",
      "check_id": "focus-visible",
      "testing_track": "section508-baseline",
      "baseline_procedure_id": "2.A-FocusVisible",
      "status": "not-tested",
      "stage": "initial",
      "artifact_sha256": null,
      "tester_type": "none",
      "evidence": [],
      "rationale": "Not yet performed; replace only with actual observations.",
      "local_procedure_id": null
    },
    {
      "case_id": "case-05",
      "check_id": "focus-not-obscured",
      "testing_track": "supplemental-wcag22",
      "baseline_procedure_id": null,
      "status": "not-tested",
      "stage": "initial",
      "artifact_sha256": null,
      "tester_type": "none",
      "evidence": [],
      "rationale": "Not yet performed; replace only with actual observations.",
      "local_procedure_id": "SUP-WEB-FOCUS-01"
    }
  ],
  "human_review": {
    "status": "pending",
    "reviewer": null,
    "evidence": []
  },
  "limitations": [
    "Template only; no accessibility evaluation has been performed.",
    "This pilot covers selected focus checks only."
  ]
}
